"Identyfikator Produktu (ID)","Product name (incl. combination)","Kod produktu","Cena ostateczna (brutto)","Obniżka_1","Obniżka_2","Typ obniżki_1","Typ obniżki_2"
"63","Bluza z kapturem Pikeur Medea zielona : KOLOR - zielony, ROZMIAR - 72","00489-MEDEA 2753-34","419.40","0.40","","percentage",""
"84","Bluzka konkursowa Pikeur biała : KOLOR - biały, ROZMIAR - 38","00555-D-TURN.SHIRT 6039-36","166.60","0.32","","percentage",""
"86","Bluzka konkursowa Pikeur biało-różowa : ROZMIAR - 36, KOLOR - biały-różowy,Bluzka konkursowa Pikeur biało-różowa : ROZMIAR - 34, KOLOR - biały-różowy,Bluzka konkursowa Pikeur biało-różowa : ROZMIAR - 38, KOLOR - biały-różowy","TURNSHIRT 6020-36 WH/PINK","92.34,164.73,164.73","0.43","","percentage",""
"94","Bluzka konkursowa Pikeur granatowa : KOLOR - granatowy, ROZMIAR - 34,Bluzka konkursowa Pikeur granatowa : ROZMIAR - 38, KOLOR - granatowy","00580-553/6008-34","164.61,185.85","0.41","","percentage",""
"105","Bluzka Pikeur Antonia czerwona : KOLOR - czerwony, ROZMIAR - 38,Bluzka Pikeur Antonia czerwona : KOLOR - czerwony, ROZMIAR - 40","ANTONIA 3699-38","128.25,128.25","0.43","","percentage",""
"202","Frak Pikeur Branca czarny : KOLOR - czarny, ROZMIAR - 34,Frak Pikeur Branca czarny : KOLOR - czarny, ROZMIAR - 36","02216-BRANCA 2807-34","621.00,659.40","0.40","","percentage",""
"209","Frak Pikeur Saphira granatowy : KOLOR - granatowy, ROZMIAR - 36,Frak Pikeur Saphira granatowy : KOLOR - granatowy, ROZMIAR - 76,Frak Pikeur Saphira granatowy : KOLOR - granatowy, ROZMIAR - 72","02233-SAPHIRA 2824-36","682.50,682.50,682.50","0.35","","percentage",""
"279","Koszula turniejowa Pikeur kratka błękitna : ROZMIAR - 39, KOLOR - błękitny,Koszula turniejowa Pikeur kratka błękitna : KOLOR - błękitny, ROZMIAR - 41,Koszula turniejowa Pikeur kratka błękitna : KOLOR - błękitny, ROZMIAR - 43,Koszula turniejowa Pikeur kratka błękitna : ROZMIAR - 40, KOLOR - błękitny","03375-H-HEMD 724-39","127.60,142.10,142.10,142.10","0.42","","percentage",""
"407","Polo konkursowe Pikeur białe : KOLOR - biały, ROZMIAR - 40,Polo konkursowe Pikeur białe : KOLOR - fuksja, ROZMIAR - 47 cm,Polo konkursowe Pikeur białe : KOLOR - biały, ROZMIAR - 41","05602-H-TURN.SHIRT 6007-40","144.42,144.42,159.50","0.42","","percentage",""
"418","Polo Pikeur Vanessa zielone : KOLOR - zielony, ROZMIAR - 34,Polo Pikeur Vanessa zielone : KOLOR - zielony, ROZMIAR - 36,Polo Pikeur Vanessa zielone : KOLOR - zielony, ROZMIAR - 38","VANESSA 3698-34","119.40,141.00,141.00","0.40","","percentage",""
"466","Termobuty HKM Madrid Winter Membran brązowe : KOLOR - brązowy, ROZMIAR - 43,Termobuty HKM Madrid Winter Membran brązowe : ROZMIAR - 44, KOLOR - brązowy,Termobuty HKM Madrid Winter Membran brązowe : KOLOR - brązowy, ROZMIAR - 41","51492100-38","246.01,246.01,246.01","0.45","","percentage",""
"519","Frak Pikeur Roxette czarny : KOLOR - czarny, ROZMIAR - 34,Frak Pikeur Roxette czarny : KOLOR - czarny, ROZMIAR - 36,Frak Pikeur Roxette czarny : KOLOR - czarny, ROZMIAR - 40,Frak Pikeur Roxette czarny : KOLOR - czarny, ROZMIAR - 72 (TO ROZMIAR 36 Z PRZEDŁUŻONYMI RĘKAWAMI),Frak Pikeur Roxette czarny : KOLOR - czarny, ROZMIAR - 38","ROXETTE 2807-34","791.20,791.20,791.20,791.20,791.20","0.20","","percentage",""
"538","Bluzka konkursowa Pikeur Alexia różowa : KOLOR - różowy, ROZMIAR - 146,Bluzka konkursowa Pikeur Alexia różowa : KOLOR - różowy, ROZMIAR - 170","ALEXIA 6009-146","126.00,139.44","0.44","","percentage",""
"573","Bluza polarowa Pikeur Fenja fioletowy melange : KOLOR - fioletowy, ROZMIAR - 38","FENJA 1553-38","267.75","0.37","","percentage",""
"660","Bluzka Eskadron Fanatics Dodo blackberry, c.bordowa 2018 : ROZMIAR - M, KOLOR - ciemnobordowy,Bluzka Eskadron Fanatics Dodo blackberry, c.bordowa 2018 : ROZMIAR - S, KOLOR - ciemnobordowy","840914167 M 2018","155.40,155.40","0.26","","percentage",""
"662","Bluzka Eskadron Fanatics Dodo lightgreen, limonkowa 2018 : KOLOR - limonkowy, ROZMIAR - M,Bluzka Eskadron Fanatics Dodo lightgreen, limonkowa 2018 : KOLOR - limonkowy, ROZMIAR - S","840914128 M 2018","151.70,155.40","0.26","","percentage",""
"739","Bluza damska Pikeur Frini łososiowa 2018 : ROZMIAR - 36, KOLOR - łososiowy 3146,Bluza damska Pikeur Frini łososiowa 2018 : ROZMIAR - 34, KOLOR - łososiowy","FRINI 3146/36","237.00,237.00","0.40","","percentage",""
"741","Kurtka męska Pikeur Sandro granatowa 2018 : KOLOR - granatowy, ROZMIAR - 50,Kurtka męska Pikeur Sandro granatowa 2018 : KOLOR - granatowy, ROZMIAR - 52,Kurtka męska Pikeur Sandro granatowa 2018 : KOLOR - granatowy, ROZMIAR - 48,Kurtka męska Pikeur Sandro granatowa 2018 : ROZMIAR - 44, KOLOR - granatowy,Kurtka męska Pikeur Sandro granatowa 2018 : KOLOR - granatowy, ROZMIAR - 46","SANDRO 1995-50","375.00,375.00,375.00,375.00,405.00","0.40","","percentage",""
"742","Bezrękawnik męski Pikeur Adiano granatowy 2018 : KOLOR - granatowy, ROZMIAR - 48,Bezrękawnik męski Pikeur Adiano granatowy 2018 : KOLOR - granatowy, ROZMIAR - 50,Bezrękawnik męski Pikeur Adiano granatowy 2018 : KOLOR - granatowy, ROZMIAR - 52","ADIANO 2341-48","323.64,323.64,323.64","0.42","","percentage",""
"796","Kurtka damska Pikeur Faye graphite blue, granatowa 2018 : KOLOR - granatowy, ROZMIAR - 36,Kurtka damska Pikeur Faye graphite blue, granatowa 2018 : KOLOR - granatowy, ROZMIAR - 34,Kurtka damska Pikeur Faye graphite blue, granatowa 2018 : KOLOR - granatowy, ROZMIAR - 32","FAYE 4780-36","367.20,367.20,389.40","0.40","","percentage",""
"798","Bluza Eskadron Fanatics Nicky szara 2018 : KOLOR - szary, ROZMIAR - XS,Bluza Eskadron Fanatics Nicky szara 2018 : ROZMIAR - S, KOLOR - szary,Bluza Eskadron Fanatics Nicky szara 2018 : ROZMIAR - M, KOLOR - szary,Bluza Eskadron Fanatics Nicky szara 2018 : ROZMIAR - L, KOLOR - szary,Bluza Eskadron Fanatics Nicky szara 2018 : KOLOR - szary, ROZMIAR - XL,Bluza Eskadron Fanatics Nicky szara 2018 : KOLOR - szary, ROZMIAR - XXL","838930310 XS","142.50,142.50,142.50,142.50,142.50,142.50","0.50","","percentage",""
"1023","Bluza Pikeur Ginny szary melanż 2018 : ROZMIAR - 34, KOLOR - szary melanż,Bluza Pikeur Ginny szary melanż 2018 : ROZMIAR - 38, KOLOR - szary melanż,Bluza Pikeur Ginny szary melanż 2018 : ROZMIAR - 36, KOLOR - szary melanż","GINNY 4744/34","213.57,358.47,358.47","0.37","","percentage",""
"1024","Bluza Pikeur Lareen granatowy 2018 : KOLOR - granatowy, ROZMIAR - 36,Bluza Pikeur Lareen granatowy 2018 : KOLOR - granatowy-pomarańczowy-błękitny-antracytowy,Bluza Pikeur Lareen granatowy 2018 : ROZMIAR - 38, KOLOR - granatowy","LAREEN 1437/36","239.40,367.20,395.38","0.40","","percentage",""
"1026","Bluza Pikeur Frida antracytowy melanż 2018 : ROZMIAR - 36, KOLOR - antracytowy melanż,Bluza Pikeur Frida antracytowy melanż 2018 : ROZMIAR - 40, KOLOR - antracytowy melanż,Bluza Pikeur Frida antracytowy melanż 2018 : ROZMIAR - 38, KOLOR - antracytowy melanż","20350100 3055 / 36","359.29,225.09,359.29","0.39","","percentage",""
"1028","Bluza Pikeur Siska brązowy 2018 : KOLOR - brązowy, ROZMIAR - 34,Bluza Pikeur Siska brązowy 2018 : KOLOR - brązowy, ROZMIAR - 36,Bluza Pikeur Siska brązowy 2018 : ROZMIAR - 38, KOLOR - brązowy,Bluza Pikeur Siska brązowy 2018 : KOLOR - brązowy, ROZMIAR - 40","SISKA 2368/34","276.57,188.37,289.17,289.17","0.37","","percentage",""
"1034","Bezrękawnik Pikeur Gil malinowy : ROZMIAR - 34, KOLOR - malinowy,Bezrękawnik Pikeur Gil malinowy : ROZMIAR - 8 m, KOLOR - różowy-biały-czarny,Bezrękawnik Pikeur Gil malinowy : KOLOR - brązowy-biały-turkusowy, ROZMIAR - 8 m","GIL 4752/34","239.85,239.85,389.35","0.35","","percentage",""
"1043","Bryczesy Pikeur Lefinia Grip szare 2018 : ROZMIAR - 36, KOLOR - jeans szary,Bryczesy Pikeur Lefinia Grip szare 2018 : ROZMIAR - 38, KOLOR - jeans szary,Bryczesy Pikeur Lefinia Grip szare 2018 : ROZMIAR - 40, KOLOR - jeans szary,Bryczesy Pikeur Lefinia Grip szare 2018 : ROZMIAR - 72, KOLOR - jeans szary,Bryczesy Pikeur Lefinia Grip szare 2018 : ROZMIAR - 76, KOLOR - jeans szary,Bryczesy Pikeur Lefinia Grip szare 2018 : ROZMIAR - 80, KOLOR - jeans szary","LAREEN 1437/36","419.40,419.40,269.40,419.40,419.40,419.40","0.40","","percentage",""
"1178","Bezrękawnik Pikeur Celia szary 2018 : KOLOR - szary, ROZMIAR - 34,Bezrękawnik Pikeur Celia szary 2018 : ROZMIAR - 38, KOLOR - szary,Bezrękawnik Pikeur Celia szary 2018 : ROZMIAR - 36, KOLOR - szary","CELIA 2006/34","237.29,395.89,395.89","0.39","","percentage",""
"1181","Kurtka Pikeu Cassia granatowa 2018 : KOLOR - granatowy, ROZMIAR - 36,Kurtka Pikeu Cassia granatowa 2018 : ROZMIAR - 38, KOLOR - granatowy,Kurtka Pikeu Cassia granatowa 2018 : KOLOR - granatowy, ROZMIAR - 34,Kurtka Pikeu Cassia granatowa 2018 : KOLOR - granatowy, ROZMIAR - 40","CASSIA 2078/36","456.00,473.40,456.00,473.40","0.40","","percentage",""
"1429","Rękawiczki Start Strong czarne : KOLOR - czarny, ROZMIAR - L,Rękawiczki Start Strong czarne : KOLOR - czarny, ROZMIAR - M,Rękawiczki Start Strong czarne : KOLOR - czarny, ROZMIAR - S,Rękawiczki Start Strong czarne : KOLOR - czarny, ROZMIAR - XL,Rękawiczki Start Strong czarne : KOLOR - czarny, ROZMIAR - XS,Rękawiczki Start Strong czarne : KOLOR - czarny, ROZMIAR - XXL","1110201/BK-L","79.00,79.00,79.00,79.00,79.00,79.00","0.41","","percentage",""
"2173","Derka przeciw muchom Eskadron navy-beige-royal, granat-biały-niebieski 2011 : ROZMIAR - Pony, KOLOR - navy-beige-royal,Derka przeciw muchom Eskadron navy-beige-royal, granat-biały-niebieski 2011 : ROZMIAR - M, KOLOR - navy-beige-royal,Derka przeciw muchom Eskadron navy-beige-royal, granat-biały-niebieski 2011 : ROZMIAR - L, KOLOR - navy-beige-royal","135853142 P 2011","149.65,149.65,149.65","0.27","0.32","percentage","percentage"
"2616","Kalosze obszywane IR Stars pomarańczowe : KOLOR - pomarańczowy, ROZMIAR - L,Kalosze obszywane IR Stars pomarańczowe : ROZMIAR - S, KOLOR - pomarańczowy","02528-IR:BE80116000/PA-L","115.00,115.00","0.25","","percentage",""
"3228","Kurtka damska Pikeur Indira czarna 2018 : KOLOR - czarny, ROZMIAR - 36,Kurtka damska Pikeur Indira czarna 2018 : ROZMIAR - 900 g,Kurtka damska Pikeur Indira czarna 2018 : KOLOR - czarny, ROZMIAR - 40","INDIRA 4705/36","367.20,367.20,600.00","0.20","","percentage",""
"3229","Bluza Pikeur Siska czarny 2018 : KOLOR - czarny, ROZMIAR - 36,Bluza Pikeur Siska czarny 2018 : KOLOR - czarny, ROZMIAR - 38,Bluza Pikeur Siska czarny 2018 : ROZMIAR - 20 g,Bluza Pikeur Siska czarny 2018 : KOLOR - czarny, ROZMIAR - 34,Bluza Pikeur Siska czarny 2018 : ROZMIAR - 200 ml","SISKA 2369/36","188.37,289.17,289.17,289.17,289.17","0.37","","percentage",""
"4443","Bluza Pikeur Frida fioletowa 2018 : KOLOR - fioletowy, ROZMIAR - 38,Bluza Pikeur Frida fioletowa 2018 : KOLOR - fioletowy, ROZMIAR - 36","FRIDA 4723/38","359.29,359.29","0.39","","percentage",""
"4931","Bezrękawnik Pikeur Gil antracytowy 2018 : ROZMIAR - 36, KOLOR - antracytowy,Bezrękawnik Pikeur Gil antracytowy 2018 : ROZMIAR - 38, KOLOR - antracytowy,Bezrękawnik Pikeur Gil antracytowy 2018 : KOLOR - antracytowy, ROZMIAR - 34","GIL 4749/36","239.85,239.85,389.35","0.35","","percentage",""
"5141","Czaprak Eskadron CS Brillant yellow, żółty SS2012 : KOLOR - yellow, ROZMIAR - DL,Czaprak Eskadron CS Brillant yellow, żółty SS2012 : ROZMIAR - VSS, KOLOR - yellow","201884739 DL 2012","139.01,139.01","0.46","","percentage",""
"5177","Czaprak Eskadron Platinum Glossy Big Square white, biały 2016 : KOLOR - szary,Czaprak Eskadron Platinum Glossy Big Square white, biały 2016 : KOLOR - white, ROZMIAR - VS","206024003 DL 2016","230.30,202.30","0.30","","percentage",""
"5255","Czaprak Eskadron Platinum Cotton Crystal white, biały 2013 : KOLOR - brązowy, ROZMIAR - Full,Czaprak Eskadron Platinum Cotton Crystal white, biały 2013 : KOLOR - granatowy","206904103 DL 2013","185.91,169.01","0.42","","percentage",""
"5263","Czaprak Eskadron Platinum Sequin Diagonal champagne, ecru 2014 : KOLOR - ecru, ROZMIAR - DL,Czaprak Eskadron Platinum Sequin Diagonal champagne, ecru 2014 : KOLOR - ecru, ROZMIAR - VS","212904122 DL 2014","199.03,199.03","0.43","","percentage",""
"5274","Czaprak Eskadron Platinum Samt Crystal ebony, brązowy 2014 : KOLOR - ebony, ROZMIAR - DL,Czaprak Eskadron Platinum Samt Crystal ebony, brązowy 2014 : ROZMIAR - VS, KOLOR - ebony","206903970 DL 2014","230.00,230.00","0.30","","percentage",""
"5276","Czaprak Eskadron Platinum Satin Performance white, biały 2012 : KOLOR - white, ROZMIAR - DL,Czaprak Eskadron Platinum Satin Performance white, biały 2012 : KOLOR - white, ROZMIAR - VS","206901403 DL 2012","192.61,165.02","0.45","","percentage",""
"5837","Derka dla psa Eskadron Platinum black, czarna 2018 : KOLOR - black, ROZMIAR - 45 cm,Derka dla psa Eskadron Platinum black, czarna 2018 : KOLOR - black, ROZMIAR - 30 cm,Derka dla psa Eskadron Platinum black, czarna 2018 : KOLOR - black, ROZMIAR - 65 cm,Derka dla psa Eskadron Platinum black, czarna 2018 : KOLOR - black, ROZMIAR - 55 cm,Derka dla psa Eskadron Platinum black, czarna 2018 : KOLOR - black, ROZMIAR - 35 cm","153024007 45 2018","125.00,125.00,129.00,129.00,125.00","0.13","","percentage",""
"5872","Smycz z obrożą Eskadron NG Vintage caviar, czarna : KOLOR - caviar,Smycz z obrożą Eskadron NG Vintage caviar, czarna : ROZMIAR - S, KOLOR - Caviar,Smycz z obrożą Eskadron NG Vintage caviar, czarna : ROZMIAR - M, KOLOR - Caviar","433803579","109.00,109.00,109.00","0.18","","percentage",""
"5882","Smycz z obrożą Eskadron NG Stars anthra-white SS2016 : ROZMIAR - L, KOLOR - anthra,Smycz z obrożą Eskadron NG Stars anthra-white SS2016 : ROZMIAR - S, KOLOR - anthra,Smycz z obrożą Eskadron NG Stars anthra-white SS2016 : ROZMIAR - M, KOLOR - anthra","431843677 L 2016","119.00,119.00,119.00","0.18","","percentage",""
"5883","Smycz z obrożą Eskadron NG Vintage czarny-fuksja : ROZMIAR - L, KOLOR - czarny-fuksja,Smycz z obrożą Eskadron NG Vintage czarny-fuksja : ROZMIAR - S, KOLOR - czarny-fuksja,Smycz z obrożą Eskadron NG Vintage czarny-fuksja : ROZMIAR - XL, KOLOR - czarny-fuksja,Smycz z obrożą Eskadron NG Vintage czarny-fuksja : ROZMIAR - M, KOLOR - czarny-fuksja","431823516 L","135.00,135.00,135.00,135.00","0.18","","percentage",""
"5888","Obroża dla psa Ekkia Diego & Luna : KOLOR - naturalny, ROZMIAR - 40 cm,Obroża dla psa Ekkia Diego & Luna : ROZMIAR - 45 cm, KOLOR - naturalny,Obroża dla psa Ekkia Diego & Luna : KOLOR - naturalny, ROZMIAR - 35 cm","409210035-50","72.00,79.00,49.00","0.18","","percentage",""
"6063","Bluza z kapturem rozpinana męska Hinz Eskadron Fanatics ciemny granat : KOLOR - granatowy, ROZMIAR - S,Bluza z kapturem rozpinana męska Hinz Eskadron Fanatics ciemny granat : ROZMIAR - L, KOLOR - granatowy,Bluza z kapturem rozpinana męska Hinz Eskadron Fanatics ciemny granat : KOLOR - granatowy, ROZMIAR - XL,Bluza z kapturem rozpinana męska Hinz Eskadron Fanatics ciemny granat : ROZMIAR - M, KOLOR - granatowy","835957414-S","180.23,180.23,180.23,180.23","0.33","","percentage",""
"6964","Legowisko dla psa Ekkia Diego & Luna : KOLOR - antracytowy, ROZMIAR - 70/60/208cm,Legowisko dla psa Ekkia Diego & Luna : KOLOR - antracytowy, ROZMIAR - 60/50/18cm,Legowisko dla psa Ekkia Diego & Luna : KOLOR - antracytowy, ROZMIAR - 50/40/17cm","409550011-70/50/5","19.00,69.00,89.00","0.20","0.44","percentage","percentage"
"7632","Skarpety Mondo-Calza sublimowane : KOLOR - biały, ROZMIAR - one size","SPJS- BIAŁY.JEDN.TĘCZA","34.90","0.51","","percentage",""
"7654","Skarpety Mondo-Calza sublimowane : KOLOR - błękitny, ROZMIAR - one size","SPJS-BŁĘKIT.JEDN.DIAM.","34.90","0.51","","percentage",""
"7735","Skarpety Horze Amira młodzieżowe śliwkowe : KOLOR - śliwkowy,Skarpety Horze Amira młodzieżowe śliwkowe : KOLOR - śliwkowy","31343-PU/GJPU-AD","34.00,34.00","0.64","","percentage",""
"8275","Bryczesy Pikeur Glenn grip athleisur czarne 2018 : KOLOR - czarny, ROZMIAR - 34,Bryczesy Pikeur Glenn grip athleisur czarne 2018 : KOLOR - czarny, ROZMIAR - 36,Bryczesy Pikeur Glenn grip athleisur czarne 2018 : KOLOR - czarny, ROZMIAR - 40,Bryczesy Pikeur Glenn grip athleisur czarne 2018 : KOLOR - czarny, ROZMIAR - 38","GLENN GRIP ATHLE 8607/34","364.00,364.00,364.00,594.00","35.00","","amount",""
"8841","Bluza Pikeur Laia czarna 2018 : KOLOR - czarny, ROZMIAR - 34,Bluza Pikeur Laia czarna 2018 : KOLOR - czarny, ROZMIAR - 36,Bluza Pikeur Laia czarna 2018 : KOLOR - czarny, ROZMIAR - 38,Bluza Pikeur Laia czarna 2018 : KOLOR - czarny, ROZMIAR - 40","LAIA 2369/34","317.40,203.40,341.40,341.40","0.40","","percentage",""
"8856","Kurtka Pikeur Noomi czarna 2018 : KOLOR - czarny, ROZMIAR - 34,Kurtka Pikeur Noomi czarna 2018 : KOLOR - czarny, ROZMIAR - 36,Kurtka Pikeur Noomi czarna 2018 : KOLOR - czarny, ROZMIAR - 38,Kurtka Pikeur Noomi czarna 2018 : KOLOR - czarny, ROZMIAR - 40","NOOMI 1810/34","319.36,319.36,319.36,479.36","0.36","","percentage",""
"8951","Bluzka konkursowa damska Equiline Grace biała : KOLOR - biały, ROZMIAR - XS,Bluzka konkursowa damska Equiline Grace biała : KOLOR - biały, ROZMIAR - M,Bluzka konkursowa damska Equiline Grace biała : KOLOR - biały, ROZMIAR - L,Bluzka konkursowa damska Equiline Grace biała : KOLOR - biały, ROZMIAR - S","H00719-001 XS","479.00,479.00,479.00,479.00","0.35","","percentage",""
"8959","Bluzka konkursowa męska Equiline Fox biała : KOLOR - biały, ROZMIAR - M,Bluzka konkursowa męska Equiline Fox biała : KOLOR - biały, ROZMIAR - L","H00452-001 M","439.00,439.00","0.35","","percentage",""
"9338","Derka dla psa Eskadron Young Star navy stars, granatowa w gwiazdki : ROZMIAR - 55 cm, KOLOR - navy stars,Derka dla psa Eskadron Young Star navy stars, granatowa w gwiazdki : ROZMIAR - 45 cm, KOLOR - navy stars,Derka dla psa Eskadron Young Star navy stars, granatowa w gwiazdki : ROZMIAR - 30 cm, KOLOR - navy stars,Derka dla psa Eskadron Young Star navy stars, granatowa w gwiazdki : ROZMIAR - 35 cm, KOLOR - navy stars","180145 353 380 / 55","129.00,129.00,129.00,129.00","0.10","","percentage",""
"9804","Bryczesy Pikeur Lucinda Grip granatowe 2018 : KOLOR - granatowy, ROZMIAR - 34,Bryczesy Pikeur Lucinda Grip granatowe 2018 : KOLOR - granatowy, ROZMIAR - 36,Bryczesy Pikeur Lucinda Grip granatowe 2018 : KOLOR - granatowy, ROZMIAR - 76,Bryczesy Pikeur Lucinda Grip granatowe 2018 : KOLOR - granatowy, ROZMIAR - 72","LUCINDA GRIP 7924/38","440.37,270.27,440.37,440.37","0.37","","percentage",""
"9805","Bryczesy Pikeur Lucinda Grip antracytowe 2018 : ROZMIAR - 36, KOLOR - antracytowy,Bryczesy Pikeur Lucinda Grip antracytowe 2018 : ROZMIAR - 38, KOLOR - antracytowy,Bryczesy Pikeur Lucinda Grip antracytowe 2018 : KOLOR - antracytowy, ROZMIAR - 40","LUCINDA GRIP 7957/36","321.75,321.75,524.25","0.25","","percentage",""
"9812","Bryczesy Pikeur Lucinda Grip antracytowe 2018 : ROZMIAR - 38, KOLOR - antracytowy,Bryczesy Pikeur Lucinda Grip antracytowe 2018 : ROZMIAR - 36, KOLOR - antracytowy","LUCINDA GRIP 7957/36","599.25,524.25","0.25","","percentage",""
"9988","Bryczesy Pikeur Shiva Kontrast antracytowe : KOLOR - antracytowy, ROZMIAR - 34,Bryczesy Pikeur Shiva Kontrast antracytowe : KOLOR - antracytowy, ROZMIAR - 72","SHIVA KONTRAST 7957/34","454.35,454.35","0.35","","percentage",""
"10340","Bryczesy Pikeur Henriette Grip granatowe 2019 : KOLOR - granatowy, ROZMIAR - 34,Bryczesy Pikeur Henriette Grip granatowe 2019 : ROZMIAR - 38, KOLOR - granatowy,Bryczesy Pikeur Henriette Grip granatowe 2019 : KOLOR - granatowy, ROZMIAR - 40,Bryczesy Pikeur Henriette Grip granatowe 2019 : KOLOR - granatowy, ROZMIAR - 36","HENRIETTE GRIP 3324/34","285.35,454.35,285.35,454.35","0.35","","percentage",""
"10342","Bryczesy Pikeur Darjeen Jeans Grip szare 2019 : KOLOR - szary, ROZMIAR - 34,Bryczesy Pikeur Darjeen Jeans Grip szare 2019 : ROZMIAR - 36, KOLOR - szary,Bryczesy Pikeur Darjeen Jeans Grip szare 2019 : ROZMIAR - 38, KOLOR - szary","145016 477 240 / 34","535.33,354.43,535.33","0.33","","percentage",""
"10343","Bryczesy Pikeur Charline Grip granatowe 2019 : KOLOR - granatowy, ROZMIAR - 34,Bryczesy Pikeur Charline Grip granatowe 2019 : KOLOR - granatowy, ROZMIAR - 36,Bryczesy Pikeur Charline Grip granatowe 2019 : ROZMIAR - 38, KOLOR - granatowy,Bryczesy Pikeur Charline Grip granatowe 2019 : KOLOR - granatowy, ROZMIAR - 72,Bryczesy Pikeur Charline Grip granatowe 2019 : KOLOR - granatowy, ROZMIAR - 76","CHARLINE GRIP 3324/34 2019","291.85,454.35,291.85,454.35,454.35","0.35","","percentage",""
"10349","Koszulka damska Pikeur Linnea pomarańczowa 2019 : KOLOR - pomarańczowy, ROZMIAR - 34,Koszulka damska Pikeur Linnea pomarańczowa 2019 : KOLOR - pomarańczowy, ROZMIAR - 38,Koszulka damska Pikeur Linnea pomarańczowa 2019 : KOLOR - pomarańczowy, ROZMIAR - 36","LINNEA 1302/34 2019","109.85,109.85,109.85","0.35","","percentage",""
"10368","Koszulka damska Pikeur Wanda granatowa 2019 : KOLOR - granatowy, ROZMIAR - 40,Koszulka damska Pikeur Wanda granatowa 2019 : ROZMIAR - 38, KOLOR - granatowy,Koszulka damska Pikeur Wanda granatowa 2019 : KOLOR - granatowy, ROZMIAR - 36,Koszulka damska Pikeur Wanda granatowa 2019 : KOLOR - granatowy, ROZMIAR - 42,Koszulka damska Pikeur Wanda granatowa 2019 : KOLOR - granatowy, ROZMIAR - 34","WANDA 1577/40 2019","99.71,99.71,99.71,99.71,99.71","0.41","","percentage",""
"10371","Koszulka polo damska Pikeur Henna biała 2019 : KOLOR - biały, ROZMIAR - 36,Koszulka polo damska Pikeur Henna biała 2019 : KOLOR - biały, ROZMIAR - 32,Koszulka polo damska Pikeur Henna biała 2019 : KOLOR - biały, ROZMIAR - 40,Koszulka polo damska Pikeur Henna biała 2019 : KOLOR - biały, ROZMIAR - 34,Koszulka polo damska Pikeur Henna biała 2019 : KOLOR - biały, ROZMIAR - 38","HENNA 1502/36 2019","133.33,140.03,106.53,140.03,140.03","0.33","","percentage",""
"10374","Bluza damska Pikeur Hayet granatowa 2019 : KOLOR - granatowy, ROZMIAR - 34,Bluza damska Pikeur Hayet granatowa 2019 : KOLOR - granatowy, ROZMIAR - 40,Bluza damska Pikeur Hayet granatowa 2019 : ROZMIAR - 38, KOLOR - granatowy,Bluza damska Pikeur Hayet granatowa 2019 : KOLOR - granatowy, ROZMIAR - 32,Bluza damska Pikeur Hayet granatowa 2019 : KOLOR - granatowy, ROZMIAR - 36","HAYET 1226/34 2019","242.56,229.76,159.36,242.56,159.36","0.36","","percentage",""
"10379","Koszulka damska Pikeur Wanda szara 2019 : ROZMIAR - 36, KOLOR - szary,Koszulka damska Pikeur Wanda szara 2019 : KOLOR - szary, ROZMIAR - 40,Koszulka damska Pikeur Wanda szara 2019 : ROZMIAR - 38, KOLOR - szary,Koszulka damska Pikeur Wanda szara 2019 : KOLOR - szary, ROZMIAR - 34","WANDA 1231/36 2019","99.71,99.71,99.71,99.71","0.41","","percentage",""
"10542","Kurtka damska Pikeur Hariet granatowa 2019 : KOLOR - granatowy, ROZMIAR - 36,Kurtka damska Pikeur Hariet granatowa 2019 : ROZMIAR - 38, KOLOR - granatowy,Kurtka damska Pikeur Hariet granatowa 2019 : KOLOR - granatowy, ROZMIAR - 40,Kurtka damska Pikeur Hariet granatowa 2019 : KOLOR - granatowy, ROZMIAR - 34","HARIET 4804/36 2019","434.85,434.85,434.85,434.85","0.35","","percentage",""
"10543","Koszulka polo damska Pikeur Dasha brudnoróżowa 2019 : ROZMIAR - 36, KOLOR - brudny róż,Koszulka polo damska Pikeur Dasha brudnoróżowa 2019 : ROZMIAR - 34, KOLOR - brudny róż,Koszulka polo damska Pikeur Dasha brudnoróżowa 2019 : ROZMIAR - 38, KOLOR - brudny róż","DASHA 2085/36 2019","179.28,179.28,179.28","0.28","","percentage",""
"10586","Bryczesy Pikeur Kallota Grip Jeans szare 2019 : KOLOR - szary, ROZMIAR - 176,Bryczesy Pikeur Kallota Grip Jeans szare 2019 : KOLOR - szary, ROZMIAR - 164,Bryczesy Pikeur Kallota Grip Jeans szare 2019 : KOLOR - szary, ROZMIAR - 170,Bryczesy Pikeur Kallota Grip Jeans szare 2019 : KOLOR - szary, ROZMIAR - 158","KALOTTA JEANS GRI 7761/176","389.98,371.38,389.98,389.98","0.38","","percentage",""
"10597","Bryczesy Pikeur Maylin Grip grafitowe 2019 : ROZMIAR - 34, KOLOR - ciemnoszary,Bryczesy Pikeur Maylin Grip grafitowe 2019 : ROZMIAR - 38, KOLOR - ciemnoszary,Bryczesy Pikeur Maylin Grip grafitowe 2019 : ROZMIAR - 36, KOLOR - ciemnoszary","MAYLIN GRIP 3357/34 2019","437.27,459.17,459.17","0.27","","percentage",""
"10624","Bluza damska Pikeur Cara szara 2019 : KOLOR - szary, ROZMIAR - 34,Bluza damska Pikeur Cara szara 2019 : KOLOR - szary, ROZMIAR - 40,Bluza damska Pikeur Cara szara 2019 : ROZMIAR - 38, KOLOR - szary,Bluza damska Pikeur Cara szara 2019 : ROZMIAR - 36, KOLOR - szary","CARA 2661/34 2019","267.33,267.33,267.33,267.33","0.33","","percentage",""
"10634","Kurtka damska przeciwdeszczowa Pikeur Yuna granatowa 2019 : KOLOR - granatowy, ROZMIAR - 34,Kurtka damska przeciwdeszczowa Pikeur Yuna granatowa 2019 : ROZMIAR - 38, KOLOR - granatowy,Kurtka damska przeciwdeszczowa Pikeur Yuna granatowa 2019 : KOLOR - granatowy, ROZMIAR - 36","YUNA 1107/34 2019","681.75,674.25,674.25","0.25","","percentage",""
"10639","Koszulka damska Pikeur Nelia oliwkowa 2019 : ROZMIAR - 36, KOLOR - oliwkowy,Koszulka damska Pikeur Nelia oliwkowa 2019 : ROZMIAR - 38, KOLOR - oliwkowy,Koszulka damska Pikeur Nelia oliwkowa 2019 : ROZMIAR - 34, KOLOR - oliwkowy","NELIA 1940/36 2019","88.04,129.58,129.58","0.38","","percentage",""
"10644","Koszulka damska Pikeur Uljana Prime ciemny róż 2019 : ROZMIAR - 34, KOLOR - ciemny róż,Koszulka damska Pikeur Uljana Prime ciemny róż 2019 : ROZMIAR - 40, KOLOR - ciemny róż,Koszulka damska Pikeur Uljana Prime ciemny róż 2019 : ROZMIAR - 38, KOLOR - ciemny róż,Koszulka damska Pikeur Uljana Prime ciemny róż 2019 : ROZMIAR - 36, KOLOR - ciemny róż","ULJANA PRIME 1386/34 2019","129.58,79.98,92.38,129.58","0.38","","percentage",""
"10651","Kurtka damska Pikeur Hariet brudnoróżowa 2019 : ROZMIAR - 36, KOLOR - brudny róż,Kurtka damska Pikeur Hariet brudnoróżowa 2019 : ROZMIAR - 34, KOLOR - brudny róż,Kurtka damska Pikeur Hariet brudnoróżowa 2019 : ROZMIAR - 40, KOLOR - brudny róż,Kurtka damska Pikeur Hariet brudnoróżowa 2019 : ROZMIAR - 38, KOLOR - brudny róż","HARIET 4806/36 2019","434.85,434.85,434.85,434.85","0.35","","percentage",""
